{
  "schema_version": "1.0.0",
  "lock_id": "lock-H06-F02-active",
  "lock_type": "file_write_set",
  "resource_ref": "product://packages/kernel/src/h06/locks-checkpoints-quarantine.ts",
  "owner_ref": "fixture://owners/H06-F02",
  "scope": "H06-F02 positive active write-set lock",
  "acquired_at": "2026-06-26T23:49:42Z",
  "expires_at": "2026-06-27T00:49:42Z",
  "status": "active",
  "stale_policy": "release or quarantine when expired before successor starts",
  "release_policy": "release after PR merge and worktree cleanup",
  "cannot_claim": [
    "production_resource_orchestration",
    "live_autonomous_worktree_orchestration",
    "mechanically_independent_agents",
    "stable_agents"
  ]
}
