{
  "schema_version": "1.0.0",
  "lock_id": "lock-H06-F02-stale-active",
  "lock_type": "resource",
  "resource_ref": "fixture://runtime/locks/stale-active",
  "owner_ref": "fixture://owners/H06-F02",
  "scope": "H06-F02 stale active lock negative",
  "acquired_at": "2026-06-26T22:00:00Z",
  "expires_at": "2026-06-26T23:00:00Z",
  "status": "active",
  "stale_policy": "release or quarantine when expired before successor starts",
  "release_policy": "release after stale lock review",
  "cannot_claim": [
    "production_resource_orchestration",
    "live_autonomous_worktree_orchestration",
    "mechanically_independent_agents",
    "stable_agents"
  ]
}
